title,id,link,totalTime,cookTIme,description,imageLink,weatherTempTag,weatherConditionTagTuna Noodle Casserole,24254,http://www.campbellskitchen.com/recipes/tuna-noodle-casserole-24254,45,25,"This comforting and reliable classic features tuna, egg noodles, cream of mushroom soup and peas, topped with a crunchy bread crumb topping. it's just delicious!",http://www.campbellskitchen.com/recipeimages/tuna-noodle-casserole-large-24254.jpg,,Hearty Chicken & Noodle Casserole,50682,http://www.campbellskitchen.com/recipes/hearty-chicken-noodle-casserole-50682,45,25,"This comforting and delicious casserole features chicken, veggies, noodles and lots of cheese. You can make the entire dish in less than an hour, and when dinner is served, everyone will be happy.",http://www.campbellskitchen.com/recipeimages/hearty-chicken-noodle-casserole-large-50682.jpg,,Quick Creamy Chicken & Noodles,24548,http://www.campbellskitchen.com/recipes/quick-creamy-chicken-noodles-24548,25,10,"Cream of chicken and mushroom soups combines with chicken, noodles and Parmesan cheese to make a delicious, family-friendly dinner in just 25 minutes.",http://www.campbellskitchen.com/recipeimages/quick-creamy-chicken-noodles-large-24548.jpg,,Chicken Alfredo,62233,http://www.campbellskitchen.com/recipes/chicken-alfredo-62233,35,15,"Seasoned, sautéed boneless chicken breast strips and fettuccine are bathed in a savory garlic and Parmesan Alfredo sauce. The result is a mouth-watering dish that can't be beat!",http://www.campbellskitchen.com/recipeimages/chicken-alfredo-large-62233.jpg,,Slow Cooker Creamy Beef Stroganoff,50426,http://www.campbellskitchen.com/recipes/slow-cooker-creamy-beef-stroganoff-50426,500,480,Your slow cooker gets the job done with this savory stroganoff recipe featuring fork-tender beef in a creamy mushroom sauce. Prep it in the morning before work and you'll come home ready to serve a delicious dish the whole family will enjoy!,http://www.campbellskitchen.com/recipeimages/slow-cooker-creamy-beef-stroganoff-large-50426.jpg,,Chicken & Broccoli Alfredo,50320,http://www.campbellskitchen.com/recipes/chicken-broccoli-alfredo-50320,500,20,"In just 30 minutes, you can serve this delectable dish, with a rich, satiny Alfredo sauce that coats chicken, broccoli and pasta.",http://www.campbellskitchen.com/recipeimages/chicken-broccoli-alfredo-large-50320.jpg,,Chicken Tetrazzini,60308,http://www.campbellskitchen.com/recipes/chicken-tetrazzini-60308,30,5,"It takes just 25 minutes to make this luscious pasta dish featuring chicken, Parmesan cheese and a creamy mushroom sauce.",http://www.campbellskitchen.com/recipeimages/chicken-tetrazzini-large-60308.jpg,,Creamy Pesto Chicken & Bow Ties,25232,http://www.campbellskitchen.com/recipes/creamy-pesto-chicken-bow-ties-25232,40,20,"On-hand ingredients like cream of chicken soup, pasta and prepared pesto sauce combine with chicken to make a mouthwatering dinner that's on the table in 40 minutes.",http://www.campbellskitchen.com/recipeimages/creamy-pesto-chicken-bow-ties-large-25232.jpg,,Baked Macaroni & Cheese,24407,http://www.campbellskitchen.com/recipes/baked-macaroni-cheese-24407,40,20,"This extra-easy version of a classic casserole is homey, cheesy and topped with crunchy bread crumbs to make it even better.",http://www.campbellskitchen.com/recipeimages/baked-macaroni-cheese-large-24407.jpg,,Speedy Sausage Rigatoni,61895,http://www.campbellskitchen.com/recipes/speedy-sausage-rigatoni-61895,30,15,Just 4 ingredients combine for a simple skillet dish that's loaded with fabulous flavor. Sautéed sweet Italian sausage and sliced zucchini combine with portobello mushroom soup and cooked pasta for a delicious meal that's an absolute winner!,http://www.campbellskitchen.com/recipeimages/speedy-sausage-rigatoni-large-61895.jpg,,Slow Cooker Golden Chicken with Noodles,25329,http://www.campbellskitchen.com/recipes/slow-cooker-golden-chicken-with-noodles-25329,430,420,"Since this delightful chicken dish cooks itself in the slow cooker, it's perfect for any time of year.  It's a family-favorite that you'll make time and again.",http://www.campbellskitchen.com/recipeimages/slow-cooker-golden-chicken-with-noodles-large-25329.jpg,,Easy Chicken Stroganoff,24443,http://www.campbellskitchen.com/recipes/easy-chicken-stroganoff-24443,45,25,This one-skillet chicken dish features a creamy mushroom sauce and a whole lot of flavor.  It's comfort food that's ready to serve in just 45 minutes.,http://www.campbellskitchen.com/recipeimages/easy-chicken-stroganoff-large-24443.jpg,,Family Spaghetti Pie,24729,http://www.campbellskitchen.com/recipes/family-spaghetti-pie-24729,60,35,"Tender spaghetti forms a crust that's filled with a kicked-up, beef-mushroom-tomato sauce and lots of cheese in this creative main-dish pie.",http://www.campbellskitchen.com/recipeimages/family-spaghetti-pie-large-24729.jpg,,Slow Cooker Spaghetti Bolognese,50454,http://www.campbellskitchen.com/recipes/slow-cooker-spaghetti-bolognese-50454,260,240,Using the slow cooker is a great way to infuse flavor into this easy-to-make meat sauce. It makes a great topping for spaghetti or your favorite pasta shape.,http://www.campbellskitchen.com/recipeimages/slow-cooker-spaghetti-bolognese-large-50454.jpg,,Baked Ziti,25342,http://www.campbellskitchen.com/recipes/baked-ziti-25342,55,30,"Short tube-shaped pasta tossed with seasoned tomato sauce, mozzarella and Parmesan cheeses is baked in a casserole until bubbling.",http://www.campbellskitchen.com/recipeimages/baked-ziti-large-25342.jpg,,Simple Chicken Florentine Alfredo with Fettuccine,61374,http://www.campbellskitchen.com/recipes/simple-chicken-florentine-alfredo-with-fettuccine-61374,35,15,"This easy-to-make, delicious pasta dish is ready in just 35 minutes! Tender chicken is coated in a rich, creamy Alfredo sauce and brightened with the addition of fresh baby spinach. Toss with fettuccine, and you've got a hearty meal that is guaranteed to please.",http://www.campbellskitchen.com/recipeimages/simple-chicken-florentine-alfredo-with-fettuccine-large-61374.jpg,,3-Cheese Pasta Bake,25195,http://www.campbellskitchen.com/recipes/3-cheese-pasta-bake-25195,40,20,"This mouthwatering version of baked macaroni and cheese is ready in just 40 minutes and features our ""secret ingredient"" cream of mushroom soup. Try it as a side dish too!",http://www.campbellskitchen.com/recipeimages/3-cheese-pasta-bake-large-25195.jpg,,Three Cheese & Spicy Sausage Baked Rigatoni,61255,http://www.campbellskitchen.com/recipes/three-cheese-spicy-sausage-baked-rigatoni-61255,55,40,"Rigatoni, sawtayed onion and three cheeses are mixed together with a jarred spicy Italian sauce that comes out of the oven hot and bubbly, and absolutely delicious!",http://www.campbellskitchen.com/recipeimages/three-cheese-spicy-sausage-baked-rigatoni-large-61255.jpg,,Easy Chicken and Pasta,24379,http://www.campbellskitchen.com/recipes/easy-chicken-and-pasta-24739,30,25,"Chicken, vegetables and pasta simmer together in a creamy mushroom sauce, touched with basil, for a carefree skillet supper.",http://www.campbellskitchen.com/recipeimages/easy-chicken-and-pasta-large-24739.jpg,,Farfalle and Tuna Casserole,61364,http://www.campbellskitchen.com/recipes/farfalle-and-tuna-casserole-61364,50,30,"This scrumptious casserole features tuna, pasta, sun-dried tomatoes and a creamy Alfredo sauce. Ready in less than 1 hour, it's sure to become a family favorite.",http://www.campbellskitchen.com/recipeimages/farfalle-and-tuna-casserole-large-61364.jpg,,One-Dish Creamy Beef & Noodles,23849,http://www.campbellskitchen.com/recipes/one-dish-creamy-beef-noodles-23849,35,25,"Streamlined in method but not in taste, beef broth gives this sawtayed beef and mushroom recipe full, hearty flavor. Plus the noodles cook right in the broth!",http://www.campbellskitchen.com/recipeimages/one-dish-creamy-beef-noodles-large-23849.jpg,no photo,Buffalo Chicken Mac & Cheese,62191,http://www.campbellskitchen.com/recipes/buffalo-chicken-mac-cheese-62191,25,5,"Penne pasta, canned chicken in Buffalo sauce, Cheddar cheese sauce, celery and blue cheese combine for a sassy mac & cheese that's kid-friendly and simply irresistible! This recipe is so easy and delicious you'll want to make it again and again!",http://www.campbellskitchen.com/recipeimages/buffalo-chicken-mac-cheese-large-62191.jpg,,Miracle Lasagna,24606,http://www.campbellskitchen.com/recipes/miracle-lasagna-24606,75,65,"Traditional, full-flavored lasagna is layered together in just minutes with pasta sauce, noodles, and three cheeses.",http://www.campbellskitchen.com/recipeimages/miracle-lasagna-large-24606.jpg,,Chicken & Noodle Casserole,60296,http://www.campbellskitchen.com/recipes/chicken-noodle-casserole-60296,45,25,A few pantry staples mix with chicken and frozen peas to make a quick-cooking casserole the whole family will love.,http://www.campbellskitchen.com/recipeimages/chicken-noodle-casserole-large-60296.jpg,no photo,Beef & Rotini Skillet,23,http://www.campbellskitchen.com/recipes/beef-rotini-skillet-23,40,20,"You'll be rewarded with smiles when you make this quick-cooking skillet dish that mixes seasoned ground beef, corn and pasta in a flavorful tomato sauce. It's sure to become a family favorite.",http://www.campbellskitchen.com/recipeimages/beef-rotini-skillet-large-23.jpg,,Ranchero Macaroni Bake,24456,http://www.campbellskitchen.com/recipes/ranchero-macaroni-bake-24456,45,25,"This tasty twist on classic mac and cheese uses picante sauce and crushed tortilla chips to kick-up the flavor, and make a good thing even better!",http://www.campbellskitchen.com/recipeimages/ranchero-macaroni-bake-large-24456.jpg,,Broccoli & Noodles Supreme,24415,http://www.campbellskitchen.com/recipes/broccoli-noodles-supreme-24415,35,25,"The trick to this simply delicious recipe is that the broccoli and noodles cook together. Mixed with a creamy, cheesy sauce, this 35-minute dish is really good!",http://www.campbellskitchen.com/recipeimages/broccoli-noodles-supreme-large-24415.jpg,,Creamy Poblano Mac & Cheese,61797,http://www.campbellskitchen.com/recipes/creamy-poblano-mac-cheese-61797,30,10,"Mac & cheese goes from ordinary to extraordinary with the addition of sawtayed fresh vegetables and creamy poblano & queso soup. This crowd pleasing casserole is incredibly good, easy to prepare and sure to earn rave reviews!",http://www.campbellskitchen.com/recipeimages/creamy-poblano-mac-cheese-large-61797.jpg,,Chicken Sorrento,60745,http://www.campbellskitchen.com/recipes/chicken-sorrento-60745,40,20,Balsamic vinegar is the secret ingredient that takes this sawtayed chicken and pasta dish to a whole new level. Chopped basil and grated Parmesan add the finishing touches that make it irresistible!,http://www.campbellskitchen.com/recipeimages/chicken-sorrento-large-60745.jpg,,Classic Lasagna,25503,http://www.campbellskitchen.com/recipes/classic-lasagna-25503,70,40,It's all about the layering when you make lasagna and is so easy when you start with a sauce already made and delicious.,http://www.campbellskitchen.com/recipeimages/classic-lasagna-large-25503.jpg,,Easy Chicken & Broccoli Alfredo,904420,http://www.campbellskitchen.com/recipes/easy-chicken-broccoli-alfredo-904420,25,5,"This family-friendly dish features cooked chicken, broccoli and a savory mushroom soup tossed with hot cooked linguine and Parmesan cheese. It's a 30-minute dish that's simply irresistible.",http://www.campbellskitchen.com/recipeimages/easy-chicken-broccoli-alfredo-large-904420.jpg,,Cheeseburger Pasta,25080,http://www.campbellskitchen.com/recipes/cheeseburger-pasta-25080,25,20,"This easy, flavorful, one-skillet supper takes pantry ingredients and combines them to make a delicious dish that's sure to become a family favorite!",http://www.campbellskitchen.com/recipeimages/cheeseburger-pasta-large-25080.jpg,,Beef and Pasta,23883,http://www.campbellskitchen.com/recipes/beef-and-pasta-23883,30,25,It couldn't be easier. The pasta cooks together in the same pan with the meat sauce. For a quick meal.,http://www.campbellskitchen.com/recipeimages/beef-and-pasta-large-23883.jpg,,Turkey Sausage & Tortellini in Creamy Tomato Basil Sauce,50216,http://www.campbellskitchen.com/recipes/turkey-sausage-tortellini-in-creamy-tomato-basil-sauce-50216,20,15,"Why eat out when you can make this creamy, restaurant-style tortellini dish in just 20 minutes. Chopped fresh basil gives the dish a bright, fresh flavor.",http://www.campbellskitchen.com/recipeimages/turkey-sausage-tortellini-in-creamy-tomato-basil-sauce-large-50216.jpg,,Turkey & Broccoli Alfredo,24113,http://www.campbellskitchen.com/recipes/turkey-broccoli-alfredo-24113,30,20,"Turkey, broccoli and linguine team up with a creamy sauce made with cream of mushroom soup and Parmesan cheese to make this family-pleasing dish.",http://www.campbellskitchen.com/recipeimages/turkey-broccoli-alfredo-large-24113.jpg,,Creamy Turkey & Vegetable Lasagna,62149,http://www.campbellskitchen.com/recipes/creamy-turkey-vegetable-lasagna-62149,75,50,"Whole grain noodles, a creamy soup mixture and a scrumptious combination of ground turkey, fresh veggies and mozzarella cheese are layered to create fantastic lasagna that's loaded with flavor. It's a deliciously different way to enjoy this popular meal.",http://www.campbellskitchen.com/recipeimages/creamy-turkey-vegetable-lasagna-large-62149.jpg,,Chicken Sausage with Farfalle Alfredo,62207,http://www.campbellskitchen.com/recipes/chicken-sausage-with-farfalle-alfredo-62207,45,25,"Farfalle pasta, chicken sausage, onion and tomatoes are tossed in a creamy basil pesto Alfredo sauce. The result is a fabulous dish that's guaranteed to be a real crowd-pleaser!",http://www.campbellskitchen.com/recipeimages/chicken-sausage-with-farfalle-alfredo-large-62207.jpg,,Cheddar Penne with Sausage & Peppers,60553,http://www.campbellskitchen.com/recipes/cheddar-penne-with-sausage-peppers-60553,40,20,This simple skillet dish combines mac and cheese with sausage and peppers to make a family-favorite dish that's on the table in less than 45 minutes!,http://www.campbellskitchen.com/recipeimages/cheddar-penne-with-sausage-peppers-large-60553.jpg,,Slow-Cooked Ratatouille with Penne,27100,http://www.campbellskitchen.com/recipes/slow-cooked-ratatouille-with-penne-27100,355,330,"You won't miss the meat at all in this fabulous veggie and pasta dish that slow-cooks for hours so that the flavors really develop. You'll see how the zucchini, eggplant and peppers combine to make a mouthwatering pasta topper.",http://www.campbellskitchen.com/recipeimages/slow-cooked-ratatouille-with-penne-large-27100.jpg,,