title,id,link,totalTime,cookTime,description,imageLink,weatherTempTag,weatherConditionTagSlow Cooker Chicken Tortilla Soup,50414,http://www.campbellskitchen.com/recipes/slow-cooker-chicken-tortilla-soup-50414,270,255,"This ultra-flavorful soup is worth the wait. The slow cooker makes it easy, and the savory combination of chicken, beans, corn and picante sauce makes it absolutely delicious!",http://www.campbellskitchen.com/recipeimages/slow-cooker-chicken-tortilla-soup-large-50414.jpg,,Slow Cooker Hearty Beef Stew,25655,http://www.campbellskitchen.com/recipes/slow-cooker-hearty-beef-stew-25655,635,615,"Colorful, hearty and tender, this slow-cooked stew features all the traditional ingredients of a good beef stew: beef, carrots, onion, potatoes, peas in a rich gravy.",http://www.campbellskitchen.com/recipeimages/slow-cooker-hearty-beef-stew-large-25655.jpg,,Loaded Potato Soup,61918,http://www.campbellskitchen.com/recipes/loaded-potato-soup-61918,65,40,"Everything you love about loaded baked potatoes can be found in a bowl of this homemade soup that everyone will enjoy. It's rich and creamy, and full of great flavor that is sure to make this soup a cold weather favorite!",http://www.campbellskitchen.com/recipeimages/loaded-potato-soup-large-61918.jpg,,Slow Cooker Bacon Potato Chowder,50416,http://www.campbellskitchen.com/recipes/slow-cooker-bacon-potato-chowder-50416,195,180,"This hearty and flavorful soup is so easy to make. Simply mix the ingredients in a slow cooker and let it do the work for you. And to make it even better, stir in Cheddar just before serving and top with a sprinkle of chives.",http://www.campbellskitchen.com/recipeimages/slow-cooker-bacon-potato-chowder-large-50416.jpg,,Sensational Chicken Noodle Soup,27286,http://www.campbellskitchen.com/recipes/sensational-chicken-noodle-soup-27286,35,25,"Sometimes you just want a good, old-fashioned chicken noodle soup. No fancy ingredients. Just great flavor.  Give this version a try. All you need is 6 ingredients and 35 minutes to make a home-style soup that you'll really enjoy.",http://www.campbellskitchen.com/recipeimages/sensational-chicken-noodle-soup-large-27286.jpg,,White Chicken Chili,24911,http://www.campbellskitchen.com/recipes/white-chicken-chili-24911,40,30,"Campbell's Condensed Cream of Chicken Soup and dry onion soup and recipe mix combine to flavor this scrumptious chili featuring chicken, white kidney beans and chili powder, and served with shredded Cheddar cheese and sliced green onion.",http://www.campbellskitchen.com/recipeimages/white-chicken-chili-large-24911.jpg,,Chicken & Corn Chowder,61892,http://www.campbellskitchen.com/recipes/chicken-corn-chowder-61892,25,20,"This comfort food classic is chock full of flavor and ready in 25 minutes. Cooked chicken, creamy herb and garlic soup, potatoes, corn, bacon and milk simmer together for incredible chowder that's an absolute winner!",http://www.campbellskitchen.com/recipeimages/chicken-corn-chowder-large-61892.jpg,,Hearty Homemade Chicken Noodle Soup Express,25029,http://www.campbellskitchen.com/recipes/hearty-homemade-chicken-noodle-soup-express-25029,30,15,"There's nothing better than a good bowl of soup, like this quick-cooking and delicious chicken noodle soup, brimming with chicken, colorful vegetables and egg noodles.",http://www.campbellskitchen.com/recipeimages/hearty-homemade-chicken-noodle-soup-express-large-25029.jpg,,Gumbo with Andouille Sausage,61841,http://www.campbellskitchen.com/recipes/gumbo-with-andouille-sausage-61841,85,60,"One taste of this fabulous gumbo and you'll think you're in New Orleans! The Cajun flavor infused broth adds incredible taste to the sausage, chicken and vegetables. Serve this at your next party for an impressive dish that's sure to be a hit with your guests!",http://www.campbellskitchen.com/recipeimages/gumbo-with-andouille-sausage-large-61841.jpg,,Easy Chicken Chili with White Beans,60393,http://www.campbellskitchen.com/recipes/easy-chicken-chili-with-white-beans-60393,25,15,In the mood for chili? No problem. Because you can have this flavorful chicken chili on the table in less than a half hour. It only tastes like it's been simmering all day.,http://www.campbellskitchen.com/recipeimages/easy-chicken-chili-with-white-beans-large-60393.jpg,,Slow Cooker Chicken Chile Tortilla Soup,27094,http://www.campbellskitchen.com/recipes/slow-cooker-chicken-chile-tortilla-soup-27094,305,270,Spice up your day with a bowl of this warm and wonderful soup that slow cooks for hours to blend many favorite Southwestern ingredients.,http://www.campbellskitchen.com/recipeimages/slow-cooker-chicken-chile-tortilla-soup-large-27094.jpg,,Mexican Tortilla Soup,61378,http://www.campbellskitchen.com/recipes/mexican-tortilla-soup-61378,30,15,"This kicked-up soup features sawtayed onions and spicy peppers combined with chicken, corn, tomatoes and black beans all simmered in a delicious broth. The result is an ultra-flavorful soup your family will love!",http://www.campbellskitchen.com/recipeimages/mexican-tortilla-soup-large-61378.jpg,,Speedy French Onion Soup,61889,http://www.campbellskitchen.com/recipes/speedy-french-onion-soup-61889,30,25,Warm up with a bowl of this savory soup that's loaded with incredible flavor. Caramelized onions simmer with sweet onion soup and beef consamay. It's topped with cheesy garlic Texas toast and is so good you may want to double the recipe because it will be gone in a flash!,http://www.campbellskitchen.com/recipeimages/speedy-french-onion-soup-large-61889.jpg,,Savory Vegetable Beef Soup,23870,http://www.campbellskitchen.com/recipes/savory-vegetable-beef-soup-23870,30,20,"You can ladle up this flavorful, homemade beef and vegetable soup in just 30 minutes.",http://www.campbellskitchen.com/recipeimages/savory-vegetable-beef-soup-large-23870.jpg,,Quick & Easy Chili,61887,http://www.campbellskitchen.com/recipes/quick-easy-chili-61887,30,20,"It just doesn't get any easier or more delicious than this! Sawtayed ground beef, onion, beans and Mexican style tomato soup simmer together to make a quick and hearty chili that everyone will love.",http://www.campbellskitchen.com/recipeimages/quick-easy-chili-large-61887.jpg,,Slow Cooker Jambalaya,50992,http://www.campbellskitchen.com/recipes/slow-cooker-jambalaya-50992,445,430,"This delectable, slow-cooked version of a traditional New Orleans-style dish features chicken, kielbasa and shrimp in a bed of rice that's been seasoned with Creole seasoning, green pepper, celery and diced tomato.",http://www.campbellskitchen.com/recipeimages/slow-cooker-jambalaya-large-50992.jpg,,Slow Cooker Hearty Mixed Bean Stew with Sausage,27004,http://www.campbellskitchen.com/recipes/slow-cooker-hearty-mixed-bean-stew-with-sausage-27004,505,490,"Here's a hearty stew to feed a hungry crowd. It features a colorful array of beans simmering with sausage and chicken broth, that slow cooks for hours, leaving you free to enjoy the day.",http://www.campbellskitchen.com/recipeimages/slow-cooker-hearty-mixed-bean-stew-with-sausage-large-27004.jpg,,Slow Cooker Hearty Beef & Bean Chili,25751,http://www.campbellskitchen.com/recipes/slow-cooker-hearty-beef-bean-chili-25751,495,480,"Since this chili slowly simmers all day long, the flavors blend together to make each bite satisfying and delicious.",http://www.campbellskitchen.com/recipeimages/slow-cooker-hearty-beef-bean-chili-large-25751.jpg,,Quick & Easy Pumpkin Soup,26666,http://www.campbellskitchen.com/recipes/quick-easy-pumpkin-soup-26666,45,35,"Pumpkin, ginger, nutmeg and applesauce flavor this creamy pureayed soup that's elegant and satisfying.  Best of all, it's ready in just 45 minutes.",http://www.campbellskitchen.com/recipeimages/quick-easy-pumpkin-soup-large-26666.jpg,,"Black Bean, Corn and Turkey Chili",27295,"http://www.campbellskitchen.com/recipes/black-bean,-corn-and-turkey-chili-27295",55,40,"Ready in less than an hour, this satisfying twist on traditional chili tastes like it's been simmering all day!","http://www.campbellskitchen.com/recipeimages/black-bean,-corn-and-turkey-chili-large-27295.jpg",,Sensational Turkey Noodle Soup,23894,http://www.campbellskitchen.com/recipes/sensational-turkey-noodle-soup-23894,25,40,"Here is a great idea for that leftover turkey! Combine it with a few simple ingredients to make a sensational soup that's incredibly good. It's a breeze to prepare, but one taste guarantees that this will become a soup time favorite recipe.",http://www.campbellskitchen.com/recipeimages/sensational-turkey-noodle-soup-large-23894.jpg,,Hearty Turkey Tortilla Soup,24138,http://www.campbellskitchen.com/recipes/hearty-turkey-tortilla-soup-24138,50,35,"Leftover turkey is easily transformed into this satisfying soup with just the right amount of spice!  Ready in just 50 minutes, it's simply delish!",http://www.campbellskitchen.com/recipeimages/hearty-turkey-tortilla-soup-large-24138.jpg,,Turkey Corn Chowder,24787,http://www.campbellskitchen.com/recipes/turkey-corn-chowder-24787,25,5,"The subtle flavor of bacon, together with the bold taste of picante sauce, makes this quick-cooking chowder, loaded with turkey and corn, really delicious.",http://www.campbellskitchen.com/recipeimages/turkey-corn-chowder-large-24787.jpg,,Vegetarian Chili,23886,http://www.campbellskitchen.com/recipes/vegetarian-chili-23886,50,30,"This quick-cooking stovetop chili, chock full of vegetables and two types of beans will fit the bill when you're looking for a meatless dish.",http://www.campbellskitchen.com/recipeimages/vegetarian-chili-large-23886.jpg,,Wild Mushroom & White Wine Soup,903893,http://www.campbellskitchen.com/recipes/wild-mushroom-white-wine-soup-903893,35,20,"Assorted wild mushrooms are sawtayed with garlic and shallots and then combined with white wine, creamy stock and fresh parsley. The exquisite flavor is what will have you coming back to this recipe again and again!",http://www.campbellskitchen.com/recipeimages/wild-mushroom-white-wine-soup-large-903893.jpg,,Zucchini Soup with Herbed Cream,50273,http://www.campbellskitchen.com/recipes/zucchini-soup-with-herbed-cream-50273,45,30,"It takes less than one hour to make this smooth and creamy zucchini soup, served with a dollop of flavorful herbed cream.",http://www.campbellskitchen.com/recipeimages/zucchini-soup-with-herbed-cream-large-50273.jpg,,Thai Roasted Squash Soup,50304,http://www.campbellskitchen.com/recipes/thai-roasted-squash-soup-50304,85,50,"This elegant, gourmet soup features layers of flavor from unusual ingredients like cream of coconut, ginger, curry and roasted butternut squash. But what makes this soup really special is that it's incredibly simple to make.",http://www.campbellskitchen.com/recipeimages/thai-roasted-squash-soup-large-50304.jpg,,West African Vegetable Stew,25742,http://www.campbellskitchen.com/recipes/west-african-vegetable-stew-25742,45,30,Tired of making the same old meat and potatoes stew? Here's a deliciously different vegetable stew that features an usual combination of sweet and savory ingredients that blend together beautifully with mouthwatering results.,http://www.campbellskitchen.com/recipeimages/west-african-vegetable-stew-large-25742.jpg,,Slow Cooker Chicken Tortilla Soup,50414,http://www.campbellskitchen.com/recipes/slow-cooker-chicken-tortilla-soup-50414,270,255,"This ultra-flavorful soup is worth the wait. The slow cooker makes it easy, and the savory combination of chicken, beans, corn and picante sauce makes it absolutely delicious!",http://www.campbellskitchen.com/recipeimages/slow-cooker-chicken-tortilla-soup-large-50414.jpg,,Thai Chicken and Vegetable Soup,61379,http://www.campbellskitchen.com/recipes/thai-chicken-and-vegetable-soup-61379,35,15,"What makes this soup taste so good? Fresh veggies, ginger-flavored broth and coconut milk. Plus, it's ready after just 15 minutes on the stove.",http://www.campbellskitchen.com/recipeimages/thai-chicken-and-vegetable-soup-large-61379.jpg,,Slow Cooker Poblano Corn Chowder with Chicken and Chorizo,50285,http://www.campbellskitchen.com/recipes/slow-cooker-poblano-corn-chowder-with-chicken-and-chorizo-50285,435,420,"Throw all the ingredients into the slow-cooker at once, and it will make this kicked-up corn chowder for you. Plus, the smoky chorizo and the spicy poblano chilies make this soup especially delicious.",http://www.campbellskitchen.com/recipeimages/slow-cooker-poblano-corn-chowder-with-chicken-and-chorizo-large-50285.jpg,,Chinese Hot & Sour Soup,61380,http://www.campbellskitchen.com/recipes/chinese-hot-sour-soup-61380,35,10,"10 minutes on the stove and you've got a restaurant-quality soup your whole family will love. The hot and sour broth is the key to the delicious bold flavor. Give it a try, you'll be so glad you did!",http://www.campbellskitchen.com/recipeimages/chinese-hot-sour-soup-large-61380.jpg,,Savory Vegetable Beef Soup,23870,http://www.campbellskitchen.com/recipes/savory-vegetable-beef-soup-23870,30,20,"Yum. You can ladle up this flavorful, homemade beef and vegetable soup in just 30 minutes.",http://www.campbellskitchen.com/recipeimages/savory-vegetable-beef-soup-large-23870.jpg,,"Ham, Potato & Cabbage Soup",50257,"http://www.campbellskitchen.com/recipes/ham,-potato-cabbage-soup-50257",70,40,"Mouthwatering, traditional flavors come together in this satisfying soup reminiscent of grandmother's kitchen.","http://www.campbellskitchen.com/recipeimages/ham,-potato-cabbage-soup-large-50257.jpg",,Spaghetti Soup,27797,http://www.campbellskitchen.com/recipes/spaghetti-soup-27297,45,30,"This easy-to-make, heart-warming soup is as fun to eat as it is good. Try it and you'll see what we mean.",http://www.campbellskitchen.com/recipeimages/spaghetti-soup-large-27297.jpg,,Taco Twist Soup,24955,http://www.campbellskitchen.com/recipes/taco-twist-soup-24955,35,25,This family-friendly recipe mixes pasta with the great flavors of tacos to make a hearty and delicious soup.,http://www.campbellskitchen.com/recipeimages/taco-twist-soup-large-24955.jpg,,Roasted Tomato & Barley Soup,27076,http://www.campbellskitchen.com/recipes/roasted-tomato-barley-soup-27076,80,65,"Roasting the tomatoes, garlic and onions makes this soup especially flavorful. After the veggies are roasted, all you need is 40 minutes and you've got a robust, rustic-style soup.",http://www.campbellskitchen.com/recipeimages/roasted-tomato-barley-soup-large-27076.jpg,,Spicy Asian Beef & Snow Pea Soup,25659,http://www.campbellskitchen.com/recipes/spicy-asian-beef-snow-pea-soup-25659,45,20,No need for takeout when you can prepare this deliciously spicy soup featuring tender-crisp vegetables and sawtayed sirloin steak strips.,http://www.campbellskitchen.com/recipeimages/spicy-asian-beef-snow-pea-soup-large-25659.jpg,,Sausage & Spinach Soup,26151,http://www.campbellskitchen.com/recipes/sausage-spinach-soup-26151,40,20,Swanson Chicken Broth is the secret to making a quick and delicious homemade soup featuring sweet Italian sausage and fresh spinach.,http://www.campbellskitchen.com/recipeimages/sausage-spinach-soup-large-26151.jpg,,